{
  "$schema": "https://json-schema.org/draft/2020-12/schema",
  "$id": "https://rewireperform.local/contracts/feedback-intelligence/staging-release-pair-v0.2/release-pair.schema.json",
  "title": "Feedback Intelligence unsigned remediation release-pair dossier",
  "type": "object",
  "additionalProperties": false,
  "required": [
    "schema_version",
    "release_status",
    "target_project_ref",
    "producer",
    "consumer",
    "invalidated_historical_gate",
    "next_gate"
  ],
  "properties": {
    "schema_version": {
      "const": "rewireperform-feedback-intelligence-staging-release-pair-v2"
    },
    "release_status": {
      "const": "UNSIGNED_AWAITING_CURRENT_CONSUMER_ACCEPTANCE"
    },
    "target_project_ref": {
      "const": "zbeswjipayspgvcipzmx"
    },
    "producer": {
      "type": "object",
      "additionalProperties": false,
      "required": [
        "source_commit",
        "gateway_manifest_sha256",
        "gateway_package_sha256",
        "audit_contract_version",
        "audit_manifest_sha256",
        "audit_package_sha256",
        "audit_sql_sha256",
        "data_path_definition_sha256"
      ],
      "properties": {
        "source_commit": {
          "type": "string",
          "pattern": "^[a-f0-9]{40}$"
        },
        "gateway_manifest_sha256": {
          "type": "string",
          "pattern": "^[a-f0-9]{64}$"
        },
        "gateway_package_sha256": {
          "type": "string",
          "pattern": "^[a-f0-9]{64}$"
        },
        "audit_contract_version": {
          "const": "0.2.0-draft"
        },
        "audit_manifest_sha256": {
          "type": "string",
          "pattern": "^[a-f0-9]{64}$"
        },
        "audit_package_sha256": {
          "type": "string",
          "pattern": "^[a-f0-9]{64}$"
        },
        "audit_sql_sha256": {
          "type": "string",
          "pattern": "^[a-f0-9]{64}$"
        },
        "data_path_definition_sha256": {
          "type": "object",
          "additionalProperties": false,
          "required": [
            "gateway",
            "internal_export"
          ],
          "properties": {
            "gateway": {
              "const": "0d617fcb5e5a7ece31ca94b7ff0cf07026712b0d9ed4206c95bee9f4b198a8af"
            },
            "internal_export": {
              "const": "89420ddf3f79ad57538f4fb1ad56458717874490ddbc88b52d577e081d3e872f"
            }
          }
        }
      }
    },
    "consumer": {
      "type": "object",
      "additionalProperties": false,
      "required": [
        "branch",
        "current_source_commit",
        "acceptance_status",
        "acceptance_commit",
        "acceptance_sha256"
      ],
      "properties": {
        "branch": {
          "const": "agent/feedback-intelligence-machine-gateway-v0-1-20260807"
        },
        "current_source_commit": {
          "type": "string",
          "pattern": "^[a-f0-9]{40}$"
        },
        "acceptance_status": {
          "const": "PENDING_CURRENT_PACKAGE_REVIEW"
        },
        "acceptance_commit": {
          "type": "null"
        },
        "acceptance_sha256": {
          "type": "null"
        }
      }
    },
    "invalidated_historical_gate": {
      "type": "object",
      "additionalProperties": false,
      "required": [
        "producer_commit",
        "consumer_commit",
        "reason",
        "can_authorize_current_gate"
      ],
      "properties": {
        "producer_commit": {
          "const": "077a35f82fe7fd7972621a9c2ea1cc481ff991e0"
        },
        "consumer_commit": {
          "const": "266eac3d362ede7ceafd2c25b6109d3c2d8c8bc0"
        },
        "reason": {
          "const": "PRE_REMEDIATION_FUNCTION_DEFINITIONS"
        },
        "can_authorize_current_gate": {
          "const": false
        }
      }
    },
    "next_gate": {
      "type": "object",
      "additionalProperties": false,
      "required": [
        "consumer_review_required",
        "migration_and_edge_staging",
        "postdeploy_metadata_audit",
        "credentials",
        "synthetic_network_read",
        "production",
        "real_data",
        "writes"
      ],
      "properties": {
        "consumer_review_required": {
          "const": true
        },
        "migration_and_edge_staging": {
          "const": false
        },
        "postdeploy_metadata_audit": {
          "const": false
        },
        "credentials": {
          "const": false
        },
        "synthetic_network_read": {
          "const": false
        },
        "production": {
          "const": false
        },
        "real_data": {
          "const": false
        },
        "writes": {
          "const": false
        }
      }
    }
  }
}
